{
  "$schema": "http://json-schema.org/draft-07/schema#",
  "$id": "https://open-relay.local/schemas/resume-project.schema.json",
  "title": "Open Relay Resume Project Packet",
  "type": "object",
  "additionalProperties": false,
  "required": [
    "packet_version",
    "packet_type",
    "created_at",
    "resume_from",
    "target",
    "resume_status",
    "confidence",
    "summary",
    "tasks",
    "reviewed_scope",
    "prior_verification",
    "safety_gates",
    "redactions",
    "next_action"
  ],
  "properties": {
    "packet_version": {
      "type": "string",
      "const": "0.1"
    },
    "packet_type": {
      "type": "string",
      "const": "resume-project"
    },
    "created_at": {
      "type": "string",
      "pattern": "^\\d{4}-\\d{2}-\\d{2}T\\d{2}:\\d{2}:\\d{2}(?:\\.\\d{3})?Z$"
    },
    "resume_from": {
      "$ref": "#/definitions/resumeFrom"
    },
    "target": {
      "$ref": "#/definitions/target"
    },
    "resume_status": {
      "type": "string",
      "enum": [
        "address_findings",
        "owner_decision",
        "continue_with_context",
        "blocked"
      ]
    },
    "confidence": {
      "type": "string",
      "enum": [
        "high",
        "medium",
        "low"
      ]
    },
    "summary": {
      "type": "string",
      "minLength": 1
    },
    "tasks": {
      "type": "array",
      "items": {
        "$ref": "#/definitions/task"
      }
    },
    "reviewed_scope": {
      "$ref": "#/definitions/reviewedScope"
    },
    "prior_verification": {
      "type": "array",
      "items": {
        "$ref": "#/definitions/verification"
      }
    },
    "safety_gates": {
      "$ref": "#/definitions/safetyGates"
    },
    "provenance": {
      "type": "array",
      "items": {
        "$ref": "#/definitions/provenance"
      }
    },
    "redactions": {
      "type": "array",
      "items": {
        "$ref": "#/definitions/redaction"
      }
    },
    "sensitive_data": {
      "$ref": "#/definitions/sensitiveData"
    },
    "next_action": {
      "type": "string",
      "minLength": 1
    }
  },
  "definitions": {
    "resumeFrom": {
      "type": "object",
      "additionalProperties": false,
      "required": [
        "packet_type",
        "packet_version",
        "created_at",
        "reviewer_name",
        "reviewer_kind",
        "outcome",
        "source"
      ],
      "properties": {
        "packet_type": {
          "type": "string",
          "const": "review-response"
        },
        "packet_version": {
          "type": "string",
          "minLength": 1
        },
        "created_at": {
          "type": "string",
          "minLength": 1
        },
        "reviewer_name": {
          "type": "string",
          "minLength": 1
        },
        "reviewer_kind": {
          "type": "string",
          "enum": [
            "agent",
            "human",
            "unknown"
          ]
        },
        "outcome": {
          "type": "string",
          "enum": [
            "approved",
            "changes_requested",
            "commentary",
            "blocked"
          ]
        },
        "source": {
          "type": "string",
          "minLength": 1
        }
      }
    },
    "target": {
      "type": "object",
      "additionalProperties": false,
      "required": [
        "repository",
        "working_branch",
        "base_commit",
        "head_commit",
        "diff_range"
      ],
      "properties": {
        "repository": {
          "type": "string",
          "minLength": 1
        },
        "working_branch": {
          "type": "string",
          "minLength": 1
        },
        "base_commit": {
          "type": "string",
          "minLength": 1
        },
        "head_commit": {
          "type": "string",
          "minLength": 1
        },
        "diff_range": {
          "type": "string",
          "minLength": 1
        },
        "pull_request_url": {
          "type": "string",
          "minLength": 1
        },
        "storage_id": {
          "type": "string",
          "minLength": 1
        }
      }
    },
    "task": {
      "type": "object",
      "additionalProperties": false,
      "required": [
        "source_finding_id",
        "severity",
        "blocking",
        "title",
        "description",
        "evidence",
        "recommendation"
      ],
      "properties": {
        "source_finding_id": {
          "type": "string",
          "minLength": 1
        },
        "severity": {
          "type": "string",
          "enum": [
            "high",
            "medium",
            "low",
            "info"
          ]
        },
        "blocking": {
          "type": "boolean"
        },
        "title": {
          "type": "string",
          "minLength": 1
        },
        "description": {
          "type": "string",
          "minLength": 1
        },
        "evidence": {
          "type": "string",
          "minLength": 1
        },
        "recommendation": {
          "type": "string",
          "minLength": 1
        },
        "location": {
          "$ref": "#/definitions/location"
        }
      }
    },
    "location": {
      "type": "object",
      "additionalProperties": false,
      "required": [
        "path"
      ],
      "properties": {
        "path": {
          "type": "string",
          "minLength": 1
        },
        "line": {
          "type": "integer",
          "minimum": 1
        },
        "symbol": {
          "type": "string",
          "minLength": 1
        }
      }
    },
    "reviewedScope": {
      "type": "object",
      "additionalProperties": false,
      "required": [
        "files",
        "limitations"
      ],
      "properties": {
        "files": {
          "type": "array",
          "items": {
            "$ref": "#/definitions/reviewedFile"
          }
        },
        "limitations": {
          "type": "array",
          "items": {
            "type": "string",
            "minLength": 1
          }
        }
      }
    },
    "reviewedFile": {
      "type": "object",
      "additionalProperties": false,
      "required": [
        "path"
      ],
      "properties": {
        "path": {
          "type": "string",
          "minLength": 1
        },
        "notes": {
          "type": "string",
          "minLength": 1
        }
      }
    },
    "verification": {
      "type": "object",
      "additionalProperties": false,
      "required": [
        "kind",
        "command",
        "result",
        "evidence"
      ],
      "properties": {
        "kind": {
          "type": "string",
          "enum": [
            "command",
            "ci",
            "manual",
            "external"
          ]
        },
        "command": {
          "type": "string",
          "minLength": 1
        },
        "result": {
          "type": "string",
          "enum": [
            "passed",
            "failed",
            "not_run",
            "unknown"
          ]
        },
        "evidence": {
          "type": "string",
          "minLength": 1
        }
      }
    },
    "safetyGates": {
      "type": "object",
      "additionalProperties": false,
      "required": [
        "preserve_unrelated_changes",
        "requires_human_approval_for_merge",
        "requires_human_approval_for_publish",
        "requires_human_approval_for_destructive_commands"
      ],
      "properties": {
        "preserve_unrelated_changes": {
          "type": "boolean",
          "const": true
        },
        "requires_human_approval_for_merge": {
          "type": "boolean",
          "const": true
        },
        "requires_human_approval_for_publish": {
          "type": "boolean",
          "const": true
        },
        "requires_human_approval_for_destructive_commands": {
          "type": "boolean",
          "const": true
        }
      }
    },
    "provenance": {
      "type": "object",
      "additionalProperties": false,
      "required": [
        "type",
        "reference",
        "supports"
      ],
      "properties": {
        "type": {
          "type": "string",
          "enum": [
            "pull_request",
            "ci_run",
            "commit",
            "issue",
            "user_note",
            "external_url"
          ]
        },
        "reference": {
          "type": "string",
          "minLength": 1
        },
        "supports": {
          "type": "string",
          "minLength": 1
        }
      }
    },
    "redaction": {
      "type": "object",
      "additionalProperties": false,
      "required": [
        "field",
        "reason"
      ],
      "properties": {
        "field": {
          "type": "string",
          "minLength": 1
        },
        "reason": {
          "type": "string",
          "minLength": 1
        },
        "replacement": {
          "type": "string",
          "minLength": 1
        }
      }
    },
    "sensitiveData": {
      "type": "object",
      "additionalProperties": false,
      "required": [
        "excluded",
        "notes"
      ],
      "properties": {
        "excluded": {
          "type": "boolean"
        },
        "notes": {
          "type": "string",
          "minLength": 1
        }
      }
    }
  }
}
